1, Denis Tyler, Supervisor: Denis Tyler, 4278.91
2, Clarissa Parker, Supervisor: Denis Tyler, 2880.68
3, Harmony Rycroft, Supervisor: Denis Tyler, 4265.37
4, Alan Patel, Supervisor: Denis Tyler, 4283.76
5, Domenic Eaton, Supervisor: Denis Tyler, 4529.1
6, Boris Wallace, Supervisor: Clarissa Parker, 2804.77
7, Maria Alexander, Supervisor: Clarissa Parker, 4185.38
8, Kurt Wright, Supervisor: Clarissa Parker, 3559.44
9, Dani James, Supervisor: Harmony Rycroft, 4534.5
10, Caitlyn Allen, Supervisor: Harmony Rycroft, 4421.13
11, Erick Uttley, Supervisor: Harmony Rycroft, 3184.42
12, Carmen Zaoui, Supervisor: Harmony Rycroft, 3540.75
13, Bernadette Dickson, Supervisor: Alan Patel, 3810.44
14, Clint Cork, Supervisor: Alan Patel, 4343.74
15, Stella Rossi, Supervisor: Alan Patel, 4206.84
16, Angela Thornton, Supervisor: Alan Patel, 3459.79
17, Cameron Pickard, Supervisor: Domenic Eaton, 3834.9
18, Enoch Umney, Supervisor: Domenic Eaton, 4161.73
19, Bryon Plant, Supervisor: Domenic Eaton, 3843.75
20, Charlize Horton, Supervisor: Domenic Eaton, 3450.39
21, Doug Kelly, Supervisor: Domenic Eaton, 2823.05
22, Elijah Eyres, Supervisor: Domenic Eaton, 3825.84
23, Cassandra Connell, Supervisor: Boris Wallace, 3806.01
24, Deborah Nurton, Supervisor: Boris Wallace, 3169.95
25, Teagan Roberts, Supervisor: Boris Wallace, 3786.57
26, Boris Spencer, Supervisor: Maria Alexander, 3904.61
27, Sabrina Robinson, Supervisor: Maria Alexander, 4069.47
28, Jacob Driscoll, Supervisor: Maria Alexander, 4442.16
29, Josh Downing, Supervisor: Maria Alexander, 2923.54
30, Manuel Griffiths, Supervisor: Kurt Wright, 3463.62
31, Maddison Silva, Supervisor: Kurt Wright, 3348.2
32, Camellia Watson, Supervisor: Kurt Wright, 3611.92
33, Bob Booth, Supervisor: Dani James, 4402.56
34, George Cassidy, Supervisor: Dani James, 4016.19
35, Hayden Collins, Supervisor: Dani James, 3325.95
36, Phillip Curtis, Supervisor: Dani James, 3825.24
37, Barney Preston, Supervisor: Caitlyn Allen, 3290.38
38, Hayden Bishop, Supervisor: Caitlyn Allen, 3381.75
39, Abbey Goodman, Supervisor: Caitlyn Allen, 4269.51
40, Caydence Mould, Supervisor: Caitlyn Allen, 4556.99
41, Josh Seymour, Supervisor: Erick Uttley, 3520.8
42, Penelope York, Supervisor: Erick Uttley, 2987.93
43, Chester Carter, Supervisor: Carmen Zaoui, 2927.97
44, Rose Abbey, Supervisor: Carmen Zaoui, 3320.49
45, Andrea Harvey, Supervisor: Carmen Zaoui, 3447.58
46, Alice Hastings, Supervisor: Bernadette Dickson, 3831.75
47, Emerald Boyle, Supervisor: Bernadette Dickson, 4019.96
48, Anthony Andersson, Supervisor: Bernadette Dickson, 3723.12
49, Nick Lomax, Supervisor: Bernadette Dickson, 4228.18
50, Boris Doherty, Supervisor: Clint Cork, 3251.91
51, David Bowen, Supervisor: Clint Cork, 4367.5
52, Sabrina Morris, Supervisor: Clint Cork, 4460.69
53, Rhea Dempsey, Supervisor: Clint Cork, 2905.4
54, Katelyn White, Supervisor: Clint Cork, 2881.15
55, Leilani Reese, Supervisor: Stella Rossi, 4210.58
56, Roger Wild, Supervisor: Charlize Horton, 3135.61
57, Ryan Grant, Supervisor: Charlize Horton, 3397.89
58, Kate Waterson, Supervisor: Charlize Horton, 4285.61
59, Lynn Martin, Supervisor: Doug Kelly, 4445.44
60, Benjamin Dowson, Supervisor: Doug Kelly, 3037.22
61, Domenic Yoman, Supervisor: Doug Kelly, 4000.8
62, Jacob Carter, Supervisor: Elijah Eyres, 4564.04
63, Javier Holmes, Supervisor: Elijah Eyres, 4090.34
64, Henry Roscoe, Supervisor: Elijah Eyres, 3923.73
65, Chadwick Bennett, Supervisor: Deborah Nurton, 4576.41
66, Liam Knight, Supervisor: Deborah Nurton, 3161.2
67, Ramon Ellison, Supervisor: Deborah Nurton, 3675.35
68, Alan Wilde, Supervisor: Boris Spencer, 4027.23
69, Rosie Hunt, Supervisor: Boris Spencer, 3068.17
70, Percy Sherwood, Supervisor: Boris Spencer, 4132.39
71, Jackeline Tobin, Supervisor: Boris Spencer, 3739.09
72, Celina Campbell, Supervisor: Sabrina Robinson, 4004.33
73, Mason Quinn, Supervisor: Sabrina Robinson, 3207.96
74, Danny Vallory, Supervisor: Sabrina Robinson, 2897.6
75, Lucas Skinner, Supervisor: Manuel Griffiths, 4326.37
76, Tyler Rehman, Supervisor: Manuel Griffiths, 4252.97
77, Daphne Mullins, Supervisor: Manuel Griffiths, 3753.27
78, Selena Patel, Supervisor: Maddison Silva, 3389.21
79, Charlize Whitmore, Supervisor: Maddison Silva, 3195.81
80, Brad Nurton, Supervisor: George Cassidy, 3993.97
81, Francesca Driscoll, Supervisor: George Cassidy, 3926.75
82, Rick Roth, Supervisor: George Cassidy, 4558.62
83, Luke Walker, Supervisor: George Cassidy, 4459.28
84, Russel Middleton, Supervisor: Hayden Collins, 3637.73
85, Michelle Mcgee, Supervisor: Hayden Collins, 3844.27
86, Margaret Hunter, Supervisor: Phillip Curtis, 3272.51
87, Matt Woods, Supervisor: Phillip Curtis, 4473.1
88, Ellen Becker, Supervisor: Phillip Curtis, 3216.18
89, Julius Robe, Supervisor: Phillip Curtis, 4497.81
90, Jazmin Porter, Supervisor: Barney Preston, 3024.9
91, Eduardo Dwyer, Supervisor: Barney Preston, 3827.15
92, Ivette Webster, Supervisor: Abbey Goodman, 3495.52
93, Noah James, Supervisor: Abbey Goodman, 2893.03
94, Rosalee Cunningham, Supervisor: Caydence Mould, 4173.53
95, Dasha Matthews, Supervisor: Caydence Mould, 3917.94
96, Michelle Asher, Supervisor: Caydence Mould, 4235.39
97, Jacob Gray, Supervisor: Andrea Harvey, 2936.27
98, Cedrick Redden, Supervisor: Andrea Harvey, 3290.01
99, Noah Thompson, Supervisor: Andrea Harvey, 3615.04
100, Tony Dillon, Supervisor: Andrea Harvey, 2725.9
101, Denny Dubois, Supervisor: Boris Doherty, 3645.94
102, Stacy Cassidy, Supervisor: David Bowen, 3114.6
103, Julianna Warren, Supervisor: David Bowen, 4254.2
104, Caleb Wild, Supervisor: David Bowen, 3437.38
105, Rosie Bishop, Supervisor: David Bowen, 3843.25
106, Benjamin Rosenbloom, Supervisor: Sabrina Morris, 3539.59
107, Bart Butler, Supervisor: Sabrina Morris, 3814.74
108, Harry Nurton, Supervisor: Sabrina Morris, 2691.95
109, Lindsay Welsch, Supervisor: Rhea Dempsey, 3724.98
110, Ronald Everett, Supervisor: Rhea Dempsey, 3031.24
111, Alessandra Scott, Supervisor: Rhea Dempsey, 3998.64
112, Alma Griffiths, Supervisor: Rhea Dempsey, 2871.78
113, Jenna Powell, Supervisor: Katelyn White, 4507.57
114, John Furnell, Supervisor: Katelyn White, 3112.49
115, Jamie Parker, Supervisor: Katelyn White, 2888.21
116, Anthony Scott, Supervisor: Katelyn White, 3511.14
117, Lucas Wilkinson, Supervisor: Leilani Reese, 2924.81
118, Havana Watson, Supervisor: Leilani Reese, 4468.36
119, Percy Hilton, Supervisor: Leilani Reese, 3196.49
120, Wade Booth, Supervisor: Leilani Reese, 2994.24
121, Clarissa Gray, Supervisor: Leilani Reese, 3510.32
122, Catherine Collins, Supervisor: Leilani Reese, 3345.25
123, Enoch Mitchell, Supervisor: Roger Wild, 2988.69
124, Abdul Heaton, Supervisor: Roger Wild, 3005.08
125, Peyton Russel, Supervisor: Roger Wild, 3998
126, Andrea Ellison, Supervisor: Ryan Grant, 4236.54
127, Carissa Quinnell, Supervisor: Ryan Grant, 3787.31
128, Estrella Gates, Supervisor: Ryan Grant, 3979.16
129, Mike Palmer, Supervisor: Ryan Grant, 3624.95
130, Carl Saunders, Supervisor: Kate Waterson, 4082.67
131, Michelle Stone, Supervisor: Kate Waterson, 3872.05
132, Aiden Craig, Supervisor: Kate Waterson, 3650.25
133, Natalie Vinton, Supervisor: Lynn Martin, 4117.7
134, Matthew Pickard, Supervisor: Lynn Martin, 2679.18
135, Sofia Steer, Supervisor: Lynn Martin, 3703.6
136, Tom Oliver, Supervisor: Lynn Martin, 2722.33
137, Agnes Chadwick, Supervisor: Benjamin Dowson, 3456.72
138, Mavis Turner, Supervisor: Benjamin Dowson, 2911.1
139, Rocco Shields, Supervisor: Benjamin Dowson, 4359.03
140, Caleb Jenkin, Supervisor: Benjamin Dowson, 3303.46
141, Roger Stevens, Supervisor: Domenic Yoman, 3766.87
142, Lucas Shea, Supervisor: Domenic Yoman, 3482.76
143, Stephanie Parker, Supervisor: Jacob Carter, 3605.26
144, Cara Bayliss, Supervisor: Jacob Carter, 3808.62
145, Francesca Sherwood, Supervisor: Jacob Carter, 4093.67
146, Daron Windsor, Supervisor: Javier Holmes, 3099.5
147, Harry Chapman, Supervisor: Javier Holmes, 3571.61
148, Rosalee Holmes, Supervisor: Javier Holmes, 3166.57
149, Skylar Attwood, Supervisor: Javier Holmes, 4191.85
150, Alexander Sinclair, Supervisor: Henry Roscoe, 4457.89
151, Alex Rixon, Supervisor: Henry Roscoe, 3535.81
152, Paige Villiger, Supervisor: Henry Roscoe, 3880.95
153, Luke London, Supervisor: Henry Roscoe, 4110.4
154, Cedrick Price, Supervisor: Henry Roscoe, 3855.37
155, Christine Herbert, Supervisor: Chadwick Bennett, 3296.4
156, Charlize Miller, Supervisor: Percy Sherwood, 3029.75
157, Mike Barclay, Supervisor: Percy Sherwood, 3301.6
158, Carl Hood, Supervisor: Percy Sherwood, 3643.03
159, Blake Noon, Supervisor: Jackeline Tobin, 3907.5
160, Bryce Calderwood, Supervisor: Jackeline Tobin, 2953.13
161, Beatrice Bradshaw, Supervisor: Jackeline Tobin, 3350.09
162, Adelaide Fenton, Supervisor: Celina Campbell, 3539.56
163, Havana Whitmore, Supervisor: Celina Campbell, 2705.17
164, Jules Mitchell, Supervisor: Celina Campbell, 3883.2
165, Julia Olivier, Supervisor: Danny Vallory, 3916.68
166, Emerald Ross, Supervisor: Danny Vallory, 4248.38
167, Ciara Mcnally, Supervisor: Danny Vallory, 4054.82
168, Bryon Leigh, Supervisor: Tyler Rehman, 3351.62
169, Caleb Boden, Supervisor: Tyler Rehman, 4133.84
170, Melanie Gray, Supervisor: Tyler Rehman, 4149.96
171, Kurt Allington, Supervisor: Tyler Rehman, 2810.53
172, Sage Forester, Supervisor: Daphne Mullins, 3242.05
173, Barney Nielson, Supervisor: Daphne Mullins, 3756.57
174, Leroy Wild, Supervisor: Daphne Mullins, 2712.26
175, Elijah Collis, Supervisor: Brad Nurton, 3335.88
176, Remy Hancock, Supervisor: Brad Nurton, 3665.41
177, Lara Simpson, Supervisor: Brad Nurton, 3036.38
178, Alan Kelly, Supervisor: Francesca Driscoll, 3371.83
179, Benny Cattell, Supervisor: Francesca Driscoll, 3910.05
180, Jacqueline Davies, Supervisor: Russel Middleton, 4398.27
181, Ellen Gardner, Supervisor: Russel Middleton, 3232.21
182, Michael Cameron, Supervisor: Russel Middleton, 3824.29
183, Marjorie Hepburn, Supervisor: Russel Middleton, 3884.9
184, Percy Rixon, Supervisor: Michelle Mcgee, 2959.89
185, Goldie Giles, Supervisor: Michelle Mcgee, 3523.25
186, Bethany Whinter, Supervisor: Margaret Hunter, 3585.41
187, Estrella Wallace, Supervisor: Margaret Hunter, 3301.33
188, Shelby Tutton, Supervisor: Margaret Hunter, 2820.66
189, Georgia Walsh, Supervisor: Margaret Hunter, 3340.32
190, Lillian Robertson, Supervisor: Matt Woods, 3018.02
191, Judith Anderson, Supervisor: Matt Woods, 2876.69
192, Chris Parker, Supervisor: Julius Robe, 3823.32
193, Joseph Nelson, Supervisor: Julius Robe, 3775.27
194, Remy Evans, Supervisor: Jazmin Porter, 2874.43
195, Crystal Pierce, Supervisor: Jazmin Porter, 2677.64
196, Florence Jacobs, Supervisor: Jazmin Porter, 2945.94
197, Mike John, Supervisor: Dasha Matthews, 3249.4
198, Greta Olson, Supervisor: Dasha Matthews, 3265.79
199, Remy Bryson, Supervisor: Dasha Matthews, 3675.23
200, Doris Mcnally, Supervisor: Dasha Matthews, 3554.47
201, Logan Edmonds, Supervisor: Tony Dillon, 3442.93
202, Emerald Lindsay, Supervisor: Denny Dubois, 3627.12
203, Peter Needham, Supervisor: Denny Dubois, 3027.03
204, Jayden Gosling, Supervisor: Denny Dubois, 3770.49
205, Maxwell Hill, Supervisor: Denny Dubois, 3584.17
206, Regina Coleman, Supervisor: Stacy Cassidy, 2720.69
207, Celina Clarke, Supervisor: Stacy Cassidy, 3091.15
208, Nicholas Alldridge, Supervisor: Stacy Cassidy, 4099.02
209, Vicky Mullins, Supervisor: Julianna Warren, 2882.77
210, Cedrick Clark, Supervisor: Julianna Warren, 3409.73
211, Scarlett Thompson, Supervisor: Julianna Warren, 2962.49
212, Chris Jarvis, Supervisor: Julianna Warren, 4074.13
213, Ron Warner, Supervisor: Caleb Wild, 3152.63
214, Shay Matthews, Supervisor: Caleb Wild, 4017.37
215, Daphne Clarke, Supervisor: Caleb Wild, 2618.28
216, Priscilla Oldfield, Supervisor: Caleb Wild, 3523.04
217, Alba Drake, Supervisor: Rosie Bishop, 3379.17
218, Julian Milner, Supervisor: Rosie Bishop, 3319.08
219, Nancy Quinnell, Supervisor: Rosie Bishop, 3454.06
220, Aiden Griffiths, Supervisor: Rosie Bishop, 3648.08
221, Carl Dillon, Supervisor: Rosie Bishop, 2884.31
222, Jessica Blackwall, Supervisor: Rosie Bishop, 3677.02
223, Sonya Ventura, Supervisor: Benjamin Rosenbloom, 3967.08
224, Rosie Hancock, Supervisor: Benjamin Rosenbloom, 3055.02
225, Percy Raven, Supervisor: Benjamin Rosenbloom, 3368.71
226, Sage Dixon, Supervisor: Bart Butler, 3595.35
227, Michelle Zaoui, Supervisor: Bart Butler, 4064.45
228, Rick Oldfield, Supervisor: Bart Butler, 3466.34
229, Elijah Kidd, Supervisor: Bart Butler, 3117.85
230, Boris Collins, Supervisor: Harry Nurton, 3108.15
231, Mabel Owen, Supervisor: Harry Nurton, 3503.97
232, Carissa Lambert, Supervisor: Harry Nurton, 3734.69
233, Clint Matthews, Supervisor: Lindsay Welsch, 3317.76
234, Amy Newman, Supervisor: Lindsay Welsch, 3269.49
235, Johnny Donnelly, Supervisor: Lindsay Welsch, 3806.28
236, Daron Waterson, Supervisor: Lindsay Welsch, 2928.92
237, Tony Nicolas, Supervisor: Ronald Everett, 3966.63
238, Ronald Bryant, Supervisor: Ronald Everett, 4086.24
239, Mavis Rees, Supervisor: Ronald Everett, 3893.4
240, Lana Walter, Supervisor: Ronald Everett, 4156.66
241, Alba Strong, Supervisor: Alessandra Scott, 3948.46
242, Mina Rosenbloom, Supervisor: Alessandra Scott, 3606.22
243, Bristol Richards, Supervisor: Alma Griffiths, 2957.52
244, Isabel Trent, Supervisor: Alma Griffiths, 4170.07
245, Maxwell Dann, Supervisor: Alma Griffiths, 4108.97
246, Aurelia Uddin, Supervisor: Jenna Powell, 3070.18
247, Rick Nayler, Supervisor: Jenna Powell, 3335.21
248, Maxwell King, Supervisor: Jenna Powell, 4025.3
249, Chad Knight, Supervisor: Jenna Powell, 3891.44
250, Nathan Morgan, Supervisor: John Furnell, 3540.99
251, Abdul Weatcroft, Supervisor: John Furnell, 4370.87
252, Valentina Walker, Supervisor: John Furnell, 3758.34
253, Victoria Flack, Supervisor: John Furnell, 2691.19
254, Doug Tyler, Supervisor: John Furnell, 4111.46
255, Helen Vince, Supervisor: Jamie Parker, 3666.47
256, Danny Neville, Supervisor: Wade Booth, 3831.69
257, Tony Vince, Supervisor: Wade Booth, 4043.5
258, Gwenyth Groves, Supervisor: Wade Booth, 3728.12
259, Brad Antcliff, Supervisor: Clarissa Gray, 3961.28
260, Sarah Fleming, Supervisor: Clarissa Gray, 3771.93
261, Ruth Yarlett, Supervisor: Clarissa Gray, 2608.73
262, Havana Rainford, Supervisor: Catherine Collins, 4165.68
263, John Stewart, Supervisor: Catherine Collins, 2990.42
264, Rita Chapman, Supervisor: Catherine Collins, 3389.25
265, Adela Mould, Supervisor: Abdul Heaton, 2718.85
266, Meredith Wright, Supervisor: Abdul Heaton, 4261.38
267, Aurelia Roberts, Supervisor: Abdul Heaton, 3583.84
268, David Jarvis, Supervisor: Andrea Ellison, 2693.07
269, Agnes Emmott, Supervisor: Andrea Ellison, 3651.06
270, Noah Wigley, Supervisor: Andrea Ellison, 3488.82
271, Fred Savage, Supervisor: Andrea Ellison, 3584.19
272, Julius Rycroft, Supervisor: Carissa Quinnell, 3977.99
273, Courtney Morris, Supervisor: Carissa Quinnell, 2673.56
274, Jayden Ralph, Supervisor: Carissa Quinnell, 4194.02
275, Angelina Strong, Supervisor: Carl Saunders, 3898.08
276, Liv Casey, Supervisor: Carl Saunders, 2647.25
277, Alan Waterhouse, Supervisor: Carl Saunders, 3690.22
278, Leroy Jarvis, Supervisor: Michelle Stone, 3781.79
279, Boris Lee, Supervisor: Michelle Stone, 3189.8
280, Gloria Robinson, Supervisor: Matthew Pickard, 3442.38
281, Matthew Thorne, Supervisor: Matthew Pickard, 3299.39
282, Stephanie Thomas, Supervisor: Matthew Pickard, 4208.4
283, Josh Addison, Supervisor: Matthew Pickard, 3452.41
284, Tom Lewis, Supervisor: Sofia Steer, 3676.88
285, Emma Rogers, Supervisor: Sofia Steer, 4304.24
286, Percy Grant, Supervisor: Tom Oliver, 2622.4
287, Leanne Flack, Supervisor: Tom Oliver, 4285.31
288, Martha Alexander, Supervisor: Tom Oliver, 4163.65
289, Mina Hamilton, Supervisor: Tom Oliver, 4148.14
290, Barry Farrow, Supervisor: Agnes Chadwick, 3823.42
291, Kieth Carter, Supervisor: Agnes Chadwick, 2766.79
292, Sonya Sinclair, Supervisor: Rocco Shields, 3364.27
293, Abdul Barrett, Supervisor: Rocco Shields, 3548.2
294, Bryce Owens, Supervisor: Caleb Jenkin, 3751.16
295, Elijah Stevens, Supervisor: Caleb Jenkin, 3132.23
296, Maria Mcneill, Supervisor: Caleb Jenkin, 3600.6
297, Kieth Riley, Supervisor: Francesca Sherwood, 4370.64
298, Johnny Bennett, Supervisor: Francesca Sherwood, 3478.41
299, Ramon Clayton, Supervisor: Francesca Sherwood, 4339.85
300, John Leslie, Supervisor: Francesca Sherwood, 3263.46
301, Aurelia Chester, Supervisor: Alexander Sinclair, 3016.34
302, Doug Edwards, Supervisor: Alex Rixon, 3377.71
303, Ron Edmonds, Supervisor: Alex Rixon, 3369.49
304, Ronald Michael, Supervisor: Alex Rixon, 3617.47
305, Amy King, Supervisor: Alex Rixon, 3826.61
306, Emery Waterhouse, Supervisor: Paige Villiger, 3971.04
307, Manuel Radley, Supervisor: Paige Villiger, 4284.56
308, Kieth Wild, Supervisor: Paige Villiger, 2670.82
309, Angela Higgs, Supervisor: Luke London, 4298.67
310, Cassidy Button, Supervisor: Luke London, 4082.27
311, Rihanna Nobbs, Supervisor: Luke London, 3257.51
312, Anthony Brown, Supervisor: Luke London, 3207.99
313, Tony Greenwood, Supervisor: Cedrick Price, 2991.33
314, Percy Walton, Supervisor: Cedrick Price, 4169
315, Marvin Harper, Supervisor: Cedrick Price, 4256.81
316, Shay Gonzales, Supervisor: Cedrick Price, 4249.63
317, Benjamin Gibbons, Supervisor: Christine Herbert, 3793.49
318, Hanna Warden, Supervisor: Christine Herbert, 4078
319, Michael Pitt, Supervisor: Christine Herbert, 3270
320, Nate Collins, Supervisor: Christine Herbert, 2955.31
321, Ron Squire, Supervisor: Christine Herbert, 2662.88
322, Nathan Summers, Supervisor: Christine Herbert, 3240.18
323, Hank Ripley, Supervisor: Charlize Miller, 4099.42
324, Quinn Price, Supervisor: Charlize Miller, 4175.54
325, Melody Ventura, Supervisor: Charlize Miller, 3813.99
326, Tom Drew, Supervisor: Mike Barclay, 4098.38
327, Kaylee Stanley, Supervisor: Mike Barclay, 3060.62
328, Bryon Williams, Supervisor: Mike Barclay, 2758.56
329, Shay Hamilton, Supervisor: Mike Barclay, 3965.04
330, Miley Murray, Supervisor: Carl Hood, 3895.59
331, Joseph Emmett, Supervisor: Carl Hood, 3686.94
332, Alessia Groves, Supervisor: Carl Hood, 4285.14
333, Doug Stark, Supervisor: Blake Noon, 3706.12
334, Bob Wilson, Supervisor: Blake Noon, 3164.46
335, Matthew Robinson, Supervisor: Blake Noon, 2531.83
336, Bart Pitt, Supervisor: Blake Noon, 3544.63
337, Logan Gibson, Supervisor: Bryce Calderwood, 4327.73
338, Willow Giles, Supervisor: Bryce Calderwood, 3453.81
339, Caitlyn Moss, Supervisor: Bryce Calderwood, 4144.65
340, Blake Collins, Supervisor: Bryce Calderwood, 4037.49
341, Marvin Powell, Supervisor: Beatrice Bradshaw, 2990.11
342, Hank Reading, Supervisor: Beatrice Bradshaw, 3656.94
343, Sebastian Collins, Supervisor: Adelaide Fenton, 3877.02
344, Benny Emmott, Supervisor: Adelaide Fenton, 4326.99
345, Bart Mcleod, Supervisor: Adelaide Fenton, 3588.32
346, Bob Edley, Supervisor: Havana Whitmore, 3184.66
347, Phoebe Haines, Supervisor: Havana Whitmore, 4312.08
348, Harry Raven, Supervisor: Havana Whitmore, 2814.19
349, Kendra Stuart, Supervisor: Havana Whitmore, 4110.55
350, Mason Rixon, Supervisor: Jules Mitchell, 2651.36
351, Johnny Clarke, Supervisor: Jules Mitchell, 4128.47
352, Fred Burge, Supervisor: Jules Mitchell, 4071.48
353, Maya Carter, Supervisor: Jules Mitchell, 3291.96
354, Luna Oatway, Supervisor: Jules Mitchell, 2580.92
355, George Upton, Supervisor: Julia Olivier, 4302.9
356, Ryan Hunter, Supervisor: Melanie Gray, 3641.77
357, Gil Cartwright, Supervisor: Melanie Gray, 2885.86
358, Livia Hill, Supervisor: Melanie Gray, 2667.85
359, Chad Miller, Supervisor: Kurt Allington, 3027.48
360, Ronald Bristow, Supervisor: Kurt Allington, 3574.68
361, Abdul Robinson, Supervisor: Kurt Allington, 3897.1
362, Mark Wellington, Supervisor: Sage Forester, 3783.07
363, Ronald Wooldridge, Supervisor: Sage Forester, 2980.45
364, Benjamin Thornton, Supervisor: Sage Forester, 3484.99
365, Tony Trent, Supervisor: Leroy Wild, 3039.71
366, Teagan Shaw, Supervisor: Leroy Wild, 4238.95
367, Noah Fall, Supervisor: Leroy Wild, 3092
368, Phillip Bailey, Supervisor: Remy Hancock, 4039.79
369, Juliette Dickson, Supervisor: Remy Hancock, 4063.6
370, Clint Briggs, Supervisor: Remy Hancock, 3483.81
371, Owen Whinter, Supervisor: Remy Hancock, 3027.73
372, Dasha Reynolds, Supervisor: Lara Simpson, 3058.3
373, Ruby Bradley, Supervisor: Lara Simpson, 3935.78
374, Hayden Whatson, Supervisor: Lara Simpson, 2797.39
375, Bart Marshall, Supervisor: Jacqueline Davies, 2688.81
376, Davina Notman, Supervisor: Jacqueline Davies, 3577.37
377, Allison Flett, Supervisor: Jacqueline Davies, 3169.12
378, Percy Andrews, Supervisor: Ellen Gardner, 2757.65
379, Rufus Scott, Supervisor: Ellen Gardner, 3465
380, Maria Gibson, Supervisor: Percy Rixon, 3336.58
381, Julius Michael, Supervisor: Percy Rixon, 2875.75
382, Paige Hamilton, Supervisor: Percy Rixon, 4276.53
383, Eryn Poole, Supervisor: Percy Rixon, 3943.07
384, Javier Pierce, Supervisor: Goldie Giles, 3726.92
385, Russel Connell, Supervisor: Goldie Giles, 3784.11
386, Tyson Ranks, Supervisor: Bethany Whinter, 4156.1
387, Benny Woodley, Supervisor: Bethany Whinter, 4286.36
388, Lucas Cobb, Supervisor: Bethany Whinter, 3602.23
389, Ally Gordon, Supervisor: Bethany Whinter, 3626.27
390, Alba Grady, Supervisor: Estrella Wallace, 4005.98
391, Drew Lewis, Supervisor: Estrella Wallace, 2964.6
392, Bristol Morley, Supervisor: Georgia Walsh, 2805.18
393, Thea Dyson, Supervisor: Georgia Walsh, 2554.24
394, Grace Wild, Supervisor: Lillian Robertson, 2947.91
395, Maxwell Hunter, Supervisor: Lillian Robertson, 3709.36
396, Nancy Strong, Supervisor: Lillian Robertson, 3752.83
397, Ivette Alexander, Supervisor: Crystal Pierce, 2544.56
398, Rosalyn Veale, Supervisor: Crystal Pierce, 2710.89
399, Gil Hunt, Supervisor: Crystal Pierce, 3553.67
400, Abdul Gibbons, Supervisor: Crystal Pierce, 4166.31
401, Bristol Giles, Supervisor: Doris Mcnally, 3702.53
402, Bernadette Morley, Supervisor: Logan Edmonds, 2724.69
403, Alessandra Blackwall, Supervisor: Logan Edmonds, 4178.05
404, Lexi Carson, Supervisor: Logan Edmonds, 3346.85
405, Ethan Furnell, Supervisor: Logan Edmonds, 3701.24
406, Josh Hunter, Supervisor: Emerald Lindsay, 2960.02
407, Charlotte Varndell, Supervisor: Emerald Lindsay, 3634.43
408, Eduardo Gregory, Supervisor: Emerald Lindsay, 3580.22
409, Carl Cann, Supervisor: Peter Needham, 3856.47
410, Kaylee Reynolds, Supervisor: Peter Needham, 4256.49
411, Noah Robertson, Supervisor: Peter Needham, 3647.23
412, Sabrina Goodman, Supervisor: Peter Needham, 2813.19
413, Audrey Neal, Supervisor: Jayden Gosling, 2819.92
414, Margot Osman, Supervisor: Jayden Gosling, 2745.61
415, Cara Richards, Supervisor: Jayden Gosling, 3409.85
416, Cedrick Furnell, Supervisor: Jayden Gosling, 3787.41
417, Martin Roth, Supervisor: Maxwell Hill, 3293.5
418, Stella Dixon, Supervisor: Maxwell Hill, 2847.85
419, Maya Yoman, Supervisor: Maxwell Hill, 3080.21
420, Joy Morrow, Supervisor: Maxwell Hill, 3958.85
421, Hayden Aldridge, Supervisor: Maxwell Hill, 3422.34
422, Peter Rodwell, Supervisor: Maxwell Hill, 4005.07
423, Manuel Bishop, Supervisor: Regina Coleman, 3301.32
424, Clint Ring, Supervisor: Regina Coleman, 3124.18
425, Shay James, Supervisor: Regina Coleman, 3850.9
426, Rocco Ellis, Supervisor: Celina Clarke, 3742.8
427, Rick Overson, Supervisor: Celina Clarke, 2715.58
428, Stella Lynch, Supervisor: Celina Clarke, 2801.17
429, Denis Yarlett, Supervisor: Celina Clarke, 3603.67
430, Destiny Notman, Supervisor: Nicholas Alldridge, 2423.58
431, Kamila Andrews, Supervisor: Nicholas Alldridge, 3511.48
432, Gwen Gosling, Supervisor: Nicholas Alldridge, 4104.04
433, Ron Amstead, Supervisor: Vicky Mullins, 3779.33
434, Ivette Partridge, Supervisor: Vicky Mullins, 4100.1
435, Denny Rowe, Supervisor: Vicky Mullins, 2804.06
436, Elena Whatson, Supervisor: Vicky Mullins, 3632.15
437, Aeris Brennan, Supervisor: Cedrick Clark, 3801.75
438, Crystal Martin, Supervisor: Cedrick Clark, 2927.14
439, Nate Scott, Supervisor: Cedrick Clark, 3289.26
440, Mark Shaw, Supervisor: Cedrick Clark, 3012.62
441, David Freeburn, Supervisor: Scarlett Thompson, 2414.1
442, Alexander Gaynor, Supervisor: Scarlett Thompson, 2808
443, Jennifer Hewitt, Supervisor: Chris Jarvis, 3331.59
444, Chelsea Thompson, Supervisor: Chris Jarvis, 3720.33
445, Robyn Craig, Supervisor: Chris Jarvis, 2632.8
446, Sofia Bloom, Supervisor: Ron Warner, 3146.21
447, Aisha Wellington, Supervisor: Ron Warner, 3481.11
448, Willow Walker, Supervisor: Ron Warner, 3557.09
449, Sofia Walsh, Supervisor: Ron Warner, 2972.49
450, Jayden Collins, Supervisor: Shay Matthews, 3664.05
451, Ryan Webster, Supervisor: Shay Matthews, 2324.3
452, Emmanuelle Tennant, Supervisor: Shay Matthews, 1498.12
453, Madison Niles, Supervisor: Shay Matthews, 3174.05
454, Julius Abbey, Supervisor: Shay Matthews, 2367.39
455, Chris Beal, Supervisor: Daphne Clarke, 825.92
456, Bart Talbot, Supervisor: Aiden Griffiths, 4033.32
457, Barney Patel, Supervisor: Aiden Griffiths, 496.5
458, Leroy Grady, Supervisor: Aiden Griffiths, 2564.5
459, Summer Forth, Supervisor: Carl Dillon, 2262.92
460, Selena Eyres, Supervisor: Carl Dillon, 2927.7
461, Sara Dallas, Supervisor: Carl Dillon, 227.64
462, Cameron Chester, Supervisor: Jessica Blackwall, 5251.95
463, Madelyn Woodcock, Supervisor: Jessica Blackwall, 583.3
464, Harmony Roth, Supervisor: Jessica Blackwall, 3213.27
465, Tess Needham, Supervisor: Rosie Hancock, 642.77
466, Nathan Preston, Supervisor: Rosie Hancock, 3614.52
467, Gwenyth Bullock, Supervisor: Rosie Hancock, 3679.28
468, Ethan Huggins, Supervisor: Sage Dixon, 5444.01
469, Daria James, Supervisor: Sage Dixon, 3359.58
470, Bree Thornton, Supervisor: Sage Dixon, 2856.06
471, Georgia Michael, Supervisor: Sage Dixon, 4476
472, Melanie Bullock, Supervisor: Michelle Zaoui, 1629.68
473, Georgia Giles, Supervisor: Michelle Zaoui, 523.92
474, Denny Ventura, Supervisor: Michelle Zaoui, 105.24
475, Marvin Richards, Supervisor: Boris Collins, 582.3
